Id;;;;FactAndLaw;;;;Topics
ga-tar_cz-2021-3-1;;;;-OMISSIS-, Luogotenente dell&rsquo;Arma dei Carabinieri, ha impugnato con richiesta di sospensione, la sanzione di stato della &ldquo;sospensione disciplinare dall&rsquo;impiego&rdquo; per mesi 8 comminata per avere il militare ricevuto avviso di garanzia per concorso in estorsione con metodo mafioso per omesso intervento in appurata vicenda estorsiva a danno di imprenditore. A sostegno del ricorso ha lamentato la violazione dell&rsquo;art. 1393, secondo e terzo capoverso, del C.O.M in quanto la fattispecie andrebbe sussunta nella residuata ipotesi di pregiudiziale penale, la violazione dei termini del procedimento disciplinare, l&rsquo;eccesso di potere per difetto di istruttoria e la violazione del principio di proporzionalit&agrave;. Ha, altres&igrave; domandato il risarcimento del danno di natura patrimoniale conseguente alla sanzione per la derivata riduzione dello stipendio, per le conseguenze sullo stato di servizio e pensionistico e di natura non patrimoniale per il danno all&rsquo;immagine. L&rsquo;Amministrazione ha resistito al ricorso sostenendo l&rsquo;inapplicabilit&agrave; della pregiudiziale penale nella parte in cui l&rsquo;art. 1393 COM la prevede per fatti compiuti in adempimento del dovere ed il rispetto dei termini di cui all&rsquo;art. 1392 COM e 97 Tu.p.imp. In sede cautelare, in esito ad attivit&agrave; istruttoria, con ordinanza n.-OMISSIS-, non riformata, &egrave; stata concessa l&rsquo;invocata sospensione. All&rsquo;udienza pubblica del 16.12.2020, trattata la controversia, il ricorso &egrave; stato trattenuto in decisione.1. Il ricorso nella parte in cui impugna il provvedimento sanzionatorio risulta fondato per la dirimente seconda censura, con assorbimento delle ulteriori. Prevede l&rsquo;art. 1393 COM al comma 1, per come riformato dall'articolo 15, comma 1, della Legge 7 agosto 2015, n. 124 e successivamente dall'articolo 4, comma 1, lettera t), del D.Lgs. 26 aprile 2016, n. 91 &ldquo;Il procedimento disciplinare, che abbia ad oggetto, in tutto o in parte, fatti in relazione ai quali procede l'autorita' giudiziaria, e' avviato, proseguito e concluso anche in pendenza del procedimento penale. Per le infrazioni disciplinari di maggiore gravita', punibili con la consegna di rigore di cui all'articolo 1362 o con le sanzioni disciplinari di stato di cui all'articolo 1357, l'autorita' competente, solo nei casi di particolare complessita' dell'accertamento del fatto addebitato al militare ovvero qualora, all'esito di accertamenti preliminari, non disponga di elementi conoscitivi sufficienti ai fini della valutazione disciplinare, promuove il procedimento disciplinare al termine di quello penale. Il procedimento disciplinare non e' comunque promosso e se gia' iniziato e' sospeso fino alla data in cui l'Amministrazione ha avuto conoscenza integrale della sentenza o del decreto penale irrevocabili, che concludono il procedimento penale, ovvero del provvedimento di archiviazione, nel caso in cui riguardi atti e comportamenti del militare nello svolgimento delle proprie funzioni, in adempimento di obblighi e doveri di servizio. Rimane salva la possibilita' di adottare la sospensione precauzionale dall'impiego di cui all'articolo 916, in caso di sospensione o mancato avvio del procedimento disciplinare&rdquo;. &Egrave;, dunque, venuta meno la cd. pregiudiziale penale obbligatoria (La disposizione ante riforma recitava &ldquo;Se per il fatto addebitato al militare &egrave; stata esercitata azione penale, ovvero &egrave; stata disposta dall'autorit&agrave; giudiziaria una delle misure previste dall'articolo 915, comma 1, il procedimento disciplinare non pu&ograve; essere promosso fino al termine di quello penale o di prevenzione e, se gi&agrave; iniziato, deve essere sospeso). &Egrave; certa l&rsquo;applicabilit&agrave; nella specie della norma per come riformata in quanto essa risulta applicabile, secondo i principi generali in materia di successione di leggi nel tempo, ai fatti di cui si &egrave; &laquo;acquisita notizia&raquo; da parte del titolare dell&rsquo;azione disciplinare dopo l&rsquo;entrata in vigore della novella all&rsquo;art. 1393 cod.mil. (28 agosto 2015 mentre nella specie l&rsquo;informazione di garanzia all&rsquo;indagato &egrave; stata notificata nel 2019) per come affermato dalle circolari del Ministero della Difesa n. M_D GMIL 0574380 e M_D GMIL 0806206, adottate rispettivamente il 26 agosto e il 13 novembre 2015, poi recepite dall&rsquo;Arma dei Carabinieri con circolare 18 gennaio 2016 n.&nbsp; 276/139-4-2009 e circolare&nbsp;n. 276/139-19-2009 del 30 ottobre 2019 in modo analogo a quanto era avvenuto per la identica novella apportata dal decreto Brunetta n.150 del 2009 al d.lgs. n.165 e ai CCNL da parte della circolare esplicativa 27 novembre 2009 n. 9 (v. in tal senso Cons. St., 2053/2020). 2. Ci&ograve; premesso e venendo alla fattispecie concreta, diversamente da quanto illustrato dalla difesa della resistente, nella fase cautelare e del merito, nella fattispecie in esame non si invoca l&rsquo;applicazione derogatoria della pregiudiziale penale per il caso di atti e comportamenti compiuti dal&nbsp;militare&nbsp;nello svolgimento delle proprie funzioni, in adempimento di obblighi e doveri di servizio (art. 1393 co.1 terzo periodo), bens&igrave; per la sua sussumibilit&agrave; nei casi eccezionali previsti per le ipotesi di &laquo;infrazioni disciplinari di maggiore gravit&agrave;, punibili con la consegna di rigore di cui all&rsquo;articolo 1362 o con le sanzioni disciplinari di stato di cui all&rsquo;articolo 1357&raquo;, qualora si riscontri &laquo;particolare complessit&agrave; dell&rsquo;accertamento del fatto addebitato al&nbsp;militare&raquo;,&nbsp;ovvero qualora,&nbsp;all&rsquo;esito di accertamenti preliminari, non si disponga&nbsp;&laquo;di elementi conoscitivi sufficienti ai fini della valutazione disciplinare (art. 1393 co. 1 secondo periodo). Mentre la prima citata deroga &egrave; ad applicazione obbligatoria, la seconda &egrave; facoltativa, frutto di una valutazione discrezionale sindacabile in sede giurisdizionale solo per manifesta illogicit&agrave; o palese irragionevolezza (cos&igrave; Cons. St. n. 6925/2019). Nella specie che l&rsquo;Amministrazione abbia mal condotto la valutazione discrezionale risulta da due elementi. In primo luogo, infatti, nella relazione finale dell&rsquo;ufficiale inquirente (v. doc. 4 fasc. Ministero della difesa) &egrave; lo stesso organo della p.a. ad affermare in diversi passi -) la complessit&agrave; delle indagini, -) la carenza allo stato di sufficienti elementi di prova al di l&agrave; dell&rsquo;imputazione da parte del P.M. ed - ) il mancato vaglio delle dichiarazioni dei collaboratori di giustizia da parte dell&rsquo;Autorit&agrave; giurisdizionale giudicante (v. in particolare 1. il rilievo che &lt;&lt;L'attivit&agrave; investigativa trae origine dalle dichiarazioni rese da collaboratori di giustizia e il relativo procedimento, ancora nella fase della conclusione delle indagini, aldil&agrave; di quanto contestato dal P.M. nel relativo capo di imputazione, allo stato attuale, non fornisce ulteriori elementi che possano in qualche misura riformare in favore del sottufficiale l'addebito disciplinare contestatogli&gt;&gt; [in par. 4 relativo alle considerazioni sull'addebito contestato]; 2. la considerazione che la difesa del militare &lt;&lt;non permette, in questo momento, una riformulazione dell'addebito n&eacute; di poter addivenire, in via amministrativa, a conclusioni che sono proprie dell'Organo Giudicate dell'A.G. procedente&gt;&gt; [in par. 4 relativo alle considerazioni sull'addebito contestato]; 3. l&rsquo;affermazione nelle conclusioni finali &lt;&lt; Pur tuttavia, in considerazione della particolare complessit&agrave; della indagini e delle gravissime accuse rivoltegli dai collaboratori di giustizia, ancora da dimostrare nel corso giudizio/dibattimento, e al fine di risaltare eventuali profili di interesse, si riportano alcuni punti evidenziati dall'inquisito nel suo scritto difensivo&hellip;.&gt;&gt;). In secondo luogo &egrave; l&rsquo;esame delle dichiarazioni dei collaboratori che induce a sussumere i fatti addebitati in fattispecie complessa/con insufficienza di elementi conoscitivi. Le dichiarazioni acquisite dei pentiti, nei &ndash; si badi - rispettivi verbali di interrogatorio di persona indagata o di persona indagata in procedimento connesso, evidenziano un loro tentennamento nel riferire all&rsquo;autorit&agrave; giudiziaria inquirente dell&rsquo;ascritto intervento mitigatorio di loro richiesta estorsiva ai danni del titolare di esercizio commerciale da parte di militare identificato nello -OMISSIS-, tentennamenti che solo l&rsquo;esame orale nel dibattimento penale pu&ograve; confermare in termini di credibilit&agrave;, credibilit&agrave; da vagliare con attenzione alla luce della circostanza che gli stessi sono stati in passato tratti in arresto per omicidio per l&rsquo;attivit&agrave; investigativa compiuta anche dal ricorrente. In particolare -OMISSIS-non ha saputo riferire chi fosse il Maresciallo intervenuto nella vicenda ed ha affermato che il -OMISSIS- ricevette telefonata di intimazione del Carabiniere a tralasciare la richiesta estorsiva; -OMISSIS-prima (2016 ) ha affermato di non ricordare chi fosse il militare (n&eacute; le sue fattezze) che incontr&ograve;, dopo la telefonata di persona a lui vicina, per poi dire, due anni dopo, nel 2018, prima che non l&rsquo;avrebbe saputo riconoscere e poi riconoscerlo in foto; -OMISSIS-, presente all&rsquo;incontro, nel 2016 riferisce il fatto addebitandolo allo -OMISSIS-, dichiarandolo di non averlo fatto prima perch&eacute; questo lo aveva fatto arrestare e di essersi deciso solo dopo collaborazione di -OMISSIS-. La sanzione va, dunque, annullata fatta, ovviamente, salva la riedizione del potere all&rsquo;esito del giudizio penale. 3. La domanda risarcitoria non pu&ograve;, invece, trovare seguito per l&rsquo;immediata sospensione della sanzione ad opera dapprima del decreto cautelare presidenziale ex art. 56 c.p.a. e di seguito dell&rsquo;ordinanza cautelare seguita da esecuzione, provvedimenti che hanno impedito il consolidarsi dei pregiudizi paventati. 4. Le spese di lite, per le ragioni della decisione e per la reciproca soccombenza, vanno compensate.;;;;"[""Procedimento amministrativo""]"
ga-tar_fi-2021-3-1;;;;La ricorrente agisce per ottenere l&rsquo;accesso alla documentazione inerente sanzioni amministrative elevate contro di lei dalla Prefettura di Firenze invano richiesta mediante l&rsquo;istanza di cui in epigrafe sulla quale si &egrave; formato il silenzio rigetto. Afferma la Sig.ra Cardone che l&rsquo;istanza dalla stessa presentata sarebbe stata solo in parte soddisfatta in quanto la Prefettura intimata non avrebbe consegnato copia dell&rsquo;elenco e/o ruolo integrale e/o lista di carico relativo alla specifica posizione del richiedente. Il ricorso non &egrave; fondato. Come specificato nella nota della Prefettura con la quale &egrave; stato riconosciuto il diritto di accesso il ruolo costituisce atto della procedura di riscossione che pertiene alla Agenzia delle Entrate non evocata nel presente giudizio. A nulla rileva il fatto che l&rsquo;Amministrazione destinataria della istanza fosse tenuta a trasmetterla all&rsquo;Ente competente, posto che tale adempimento di natura interna non influisce sulla legittimazione processuale. Il rigetto del ricorso per palese difetto di legittimazione della Amministrazione intimata comporta la revoca del decreto di gratuito patrocinio concesso alla ricorrente e la sua condanna alle spese processuali.;;;;"[""Sospensione Concessione""]"
