,choose_one,text_no_rt,type,user
314,Caution and advice,LIVE NOW: the Mayor is updating New Yorkers on #Sandy: http://t.co/1y3SaPsl,Informative (Indirect),HealthcareWen
315,Caution and advice,Mayor Bloomberg: The 76 shelters we opened will remain open today. #Sandy #NYC,Informative (Indirect),HeiddiZ
316,Unknown,Wonderful story in @globeandmail about a #yorku grad student making a difference. #sandy #yorkpride #cdnpse http://t.co/3JJIV9nJ,Informative (Indirect),HomaJafarii
317,Caution and advice,9 states along Mid-Atlantic coast declare state of emergency-info&updates here + evac zone maps/guides for #NYC http://t.co/xuL3kt1a #Sandy,Informative (Indirect),HotmaMejia
318,"Donations of money, goods or services",Ppl in #RedHook need candles batteries flashlights food. Stores here out. Bring them here: 767 Hicks st. http://t.co/HVw5JZSR #sandy,Informative (Indirect),huslage
319,Information Source,Eery images from the empty #NYC subways - http://t.co/fPNelP3M #sandy,Informative (Indirect),iamonlynadine
320,Casualties and damage,NYC firefighters look up at a collapsed crane dangling from a building | http://t.co/8abQk4SC #Sandy,Informative (Indirect),ibejedi
321,Information Source,Heftig.... #sandy RT @frischkopp: Wahnsinn! The Most Shocking Photos After the Devastation of Hurricane Sandy http://t.co/Xw5m59H8,Informative (Indirect),ihbrune
322,Unknown,Krauthammer SLAMS Obama Over Hurricane Sandy Photo-Op (Video) http://t.co/BEXCr9e9 via @sharethis,Informative (Indirect),Illiberalality
323,Unknown,Double Rainbow Shines in NYC After Superstorm Sandy http://t.co/K7s2Zwro via @mashable,Informative (Indirect),Impact360_
324,Casualties and damage,.@MikeBloomberg: 47000 customers have lost power in NYC mainly in Queens and Staten Island. #Sandy,Informative (Indirect),Its_Remy_Ma
325,Unknown,"Head of FEMA on hurricane Sandy: ""I want people to be safe."" // Mitt Romney on FEMA: I want it shut down.",Informative (Indirect),itsjustahobby
326,Casualties and damage,NYC mayor press conference now: damages to subway & mass transit likely worst in history of system. Yet NYC depends on mass transit. #Sandy,Informative (Indirect),JanetPhD
327,Caution and advice,#Sandy #Updates: Over 13500 flight cancelled and counting due to Hurricane Sandy.. #NYC #NJ http://t.co/yUClpuNt,Informative (Indirect),JasminGranado
328,Information Source,Hurricane Sandy Shows We Need To Prepare For Climate Change Cuomo And Bloomberg Say http://t.co/DfDc4rkI via @HuffingtonPost,Informative (Indirect),Jelani_Jones
329,Casualties and damage,"NYU cancer research lost in #Sandy flood ""will likely set back scientists' work by years."" http://t.co/8ksFdp8v",Informative (Indirect),Jenntrix
330,Unknown,Mitt's soup can solution to Sandy. http://t.co/B7ZAiC21,Informative (Indirect),jennygadget
331,Unknown,Romney bought $5k of food for people to ÃƒÂ¤ÃƒÂ³ÃƒÂ¬donateÃƒÂ¤ÃƒÂ³Ã‚Â back to him at phony ÃƒÂ¤ÃƒÂ³ÃƒÂ¬hurricaneÃƒÂ¤ÃƒÂ³Ã‚Â rally http://t.co/aqUSQxqo via @AMERICAblog,Informative (Indirect),JerryOD
332,Caution and advice,The time for evacuation is over. Conditions are dangerous and will get worse. Please stay where you are #Sandy #NYC http://t.co/KQp2f2vX,Informative (Indirect),jmbelcher
333,Caution and advice,If in immediate need of shelter please visit http://t.co/Pgxt83by to locate your nearest options. #shelter #Sandy,Informative (Indirect),jmgreenwell
334,Unknown,#NYC last night was eerily dark because of #sandy http://t.co/WILdwpbf,Informative (Indirect),JoeJaen
335,Caution and advice,Empty streets of Soho NYC by @xhank. http://t.co/pQxgRVG1 #sandy,Informative (Indirect),johndavisonx
336,Caution and advice,...FLOODING POSSIBLE FROM REMNANTS OF HURRICANE SANDY... .THE REMNANTS OF HURRICANE SANDY WILL LINGER OVER CENTRAL PENN http://t.co/NDA9XSgt,Informative (Indirect),Johnstown_WX
337,Casualties and damage,#Blackouts affect 500K as #Hurricane #Sandy #Reach in 1hr the #EastCoast | http://t.co/d2DxFlY0| #Virginia #Main #Storm #NYC #NY #NJ #Boston,Informative (Indirect),Join____Us
338,Casualties and damage,Listened to New York radio this morning. Apparently the locations in every Billy Joel and Bruce Springsteen song are flooded. #Sandy,Informative (Indirect),jonesbrian
339,Caution and advice,BREAKING: At 7 PM all four East River bridges will shut down: Brooklyn Manhattan Williamsburg and Ed Koch Queensboro Bridges. #Sandy,Informative (Indirect),Jsurvivor_nyc
340,Information Source,LIVE: US President @barackobama arrives in Atlantic City New Jersey to inspect damage caused by#Sandy http://t.co/H9FXzHLQ,Informative (Indirect),julieragolia
341,Caution and advice,#JFK airport in #NYC now gusting to 71 mph - the highest observed gusts so far in NYC during #Sandy.,Informative (Indirect),JusAire
342,Information Source,Wow! RT @AlexJamesFitz: RT @weeddude: Photo: View of crane on W 57th street through a telescope http://t.co/E46e2sSi (@cmwdotme) #NYC #Sandy,Informative (Indirect),JustJay74
343,Casualties and damage,This is...unreal. Essentially the only building with power in #NYC right now is the Empire State Building. #Sandy http://t.co/ScVhG8qH,Informative (Indirect),jwaite89
344,Unknown,WireUpdate U.S. stock markets to reopen Wednesday after Sandy kills 43: NEW YORK CITY (BNO NEWS) -- Major stock ... http://t.co/yxzFVqlP,Informative (Indirect),JwForum
345,Casualties and damage,At least 50 U.S. deaths now linked to #Sandy -- among a total of 118 worldwide. http://t.co/W3BSwLBL,Informative (Indirect),jws6220
346,Casualties and damage,No jumping today kids! -&gt; Trampoline hanging on electrical cables (Milford Connecticut) #Sandy http://t.co/9WDbJ0dT,Informative (Indirect),KalyndaHaaf
347,Casualties and damage,#Sandy In #Haiti 54 confirmed deaths were reported 20 injured and 20 missing http://t.co/Kbe1Jp7o cc: @pahodisasters,Informative (Indirect),katellington
348,Caution and advice,Gov. Cuomo has directed the Port Authority and the MTA to close NYC bridges at 7:00 PM http://t.co/ViLRqyQU #Sandy,Informative (Indirect),katew
349,Casualties and damage,A boat rests on the tracks at NY's Metro-North's Ossining Station on the Hudson Line (Photo via MTA) #Sandy http://t.co/XYY7ySwC,Informative (Indirect),kathrynlopez
350,Caution and advice,"ConEd CEO on #Sandy: ""There is a significant chance of flooding throughout NYC""",Informative (Indirect),KCMichelle
351,"Donations of money, goods or services",NYC ALERT: ALL evacuation shelters are pet friendly - don't leave your pets behind! http://t.co/Xs6MngZp #SANDY #sandypets,Informative (Indirect),Kel5280
352,Caution and advice,Biggest outage clusters get repaired first. Smaller clusters to follow. #Westchester #NYC #Sandy #ConEdison,Informative (Indirect),KelleyChubb
353,Unknown,Sandy will keep stock markets closed a second day Tuesday. First time for that since 1888. http://t.co/bOV5hf43,Informative (Indirect),kellyperil
354,Caution and advice,RT @achorowitz: 630-1030 PM will be the worst of the storm in NYC says Bloomberg #nyc #sandy,Informative (Indirect),Kenosen2
355,Caution and advice,NYC Mayor Bloomberg: ConEd may shut down power in southern Brooklyn and lower Manhattan. #Sandy,Informative (Indirect),kerstinshamberg
356,Caution and advice,#IFWT Experts Say 8 O'Clock Is When Hurricane Sandy Unleashes Her Fury On NYC - http://t.co/TQSYfNah,Informative (Indirect),KidDuckie
357,Casualties and damage,Sandy: More than/or 54 people died. (USA). International crisis. Nargis: More than 80.000 people died. (Burma). No one cares.,Informative (Indirect),KimIversenFY
358,Casualties and damage,Times Square in #NYC has been abandoned because of hurricane #Sandy. The lights are still shining though. http://t.co/t88apVoO,Informative (Indirect),Kirkster555
359,Casualties and damage,UPDATE: Construction crane collapses in midtown Manhattan as #HurricaneSandy roars into NYC http://t.co/VR4ul19o #Sandy,Informative (Indirect),KONAhaze
360,Unknown,Tracking Sandy and problems on the East Coast. The Takeaway live from NYC is next on http://t.co/1ix2orJh & 90.7fm,Informative (Indirect),KSERfm
361,Caution and advice,NYC Mayor Bloomberg: ConEd may shut down power in southern Brooklyn and lower Manhattan. #Sandy,Informative (Indirect),ksrgatorfn
362,Information Source,Mortgage servicers don't need approval from @fanniemae to grant disaster relief forbearance http://t.co/LeyrkpRO #Sandy,Informative (Indirect),KYWeise
363,Unknown,#Hurricane #sandy #cnn #NYC http://t.co/mp56mbxk,Informative (Indirect),l_wed
364,Casualties and damage,Still unbelievable RT @RyanNewYork: Wow from Hell's Kitchen - the entire front of this building fell off! http://t.co/1lUZ5lAj #nyc #sandy,Informative (Indirect),LadyBlueICU
365,Unknown,Obama lands in Atlantic City New Jersey to observe #Sandy damage -ABC,Informative (Indirect),larazalloum
366,Casualties and damage,NYC news anchors and producers watching crane and whispering ÃƒÂ¤ÃƒÂ³ÃƒÂ¬fall fall!ÃƒÂ¤ÃƒÂ³Ã‚Â #Sandy,Informative (Indirect),Larchmontbroker
367,Information Source,Reader Photos Show Hurricane Sandy's Effects So Far http://t.co/RpZrXIUT,Informative (Indirect),LarchmontDV
368,"Donations of money, goods or services",Here's a round-up of volunteer opportunities throughout NYC - http://t.co/3LPRcgTe #sandy #sandyvolunteer #sandyaid,Informative (Indirect),laripley
369,Caution and advice,Alternate side parking and meter regulations are suspended citywide tomorrow. #Sandy,Informative (Indirect),lauritacruz47
370,Casualties and damage,HMS Bounty Crew Member confirmed dead. Body Recovered by US Coast Guard. #sandy http://t.co/ajrF6sC6,Informative (Indirect),LibertyBelleJ
371,Casualties and damage,NYC firefighters look up at a collapsed crane dangling from a building | http://t.co/8abQk4SC #Sandy,Informative (Indirect),lillo_c
372,Casualties and damage,UPDATE: At least 33 deaths blamed on Sandy: Superstorm Sandy winds down leaving 33 people dead and more than 7... http://t.co/8XXEKkNT,Informative (Indirect),lincolnnedaily
373,Casualties and damage,Absolutely heartbreaking MT@nytimes: @ least 39 people have died due 2 Hurricane Sandy. Here are a few of their stories.http://t.co/jN7NJhbk,Informative (Indirect),lishaarino
374,Caution and advice,The most severe part of the storm is now beginning-Mayor Bloomberg. NYC #Sandy,Informative (Indirect),longfellow520
375,Caution and advice,On the news it says Cumberland is going to get it hard tonight by Sandy!!,Informative (Indirect),LovinMyMistakes
376,Unknown,Wow! #HurricaneSandy #sandy #NYC http://t.co/0gAD1noM,Informative (Indirect),LUBERPA
377,Unknown,Carole Vordeman looks like she's broadcasting live from Hurricane Sandy. #prideofbritain,Informative (Indirect),lynnmurr
378,Caution and advice,"Mayor Bloomberg: ""Please use 311 for downed trees and flooding not 911."" #Sandy #NYC",Informative (Indirect),MadameRamotswe
379,Unknown,How A Facebook Page Prepared A Region For Hurricane Sandy And What That Teaches About Social Media: Today is st... http://t.co/qkRdL1PJ,Informative (Indirect),MajA_MiDe
380,Unknown,WOW can't believe sharks are swimming the streets/yard of NYC/New Jersey. ScaryÃƒâ€œÃ‚â€¹Ã‚Ë†Ãƒâ€œÃ‚â€¹Ã‚Ë† keep yourselves safe guys #Sandy http://t.co/pjHbb2v9,Informative (Indirect),ManalHan
381,Unknown,#OccupyWallStreet's response to Hurricane Sandy: http://t.co/Wk1looZX,Informative (Indirect),mancunion_news
382,Casualties and damage,18000 Families Homeless In Haiti After Hurricane Sandy http://t.co/qxkU8tdH,Informative (Indirect),mantsekev
383,Caution and advice,New York's #JFK and #Newark Liberty airports reopen after two days of cancellations. La Guardia remains closed http://t.co/3yLWVeam #Sandy,Informative (Indirect),MarcClimaco
384,Casualties and damage,RT @cnn: More than 765000 power outages so far due to Hurricane Sandy. Latest info on @CNN TV and our live blog: http://t.co/OkHC8ssW,Informative (Indirect),mariamccloud
385,Caution and advice,NYC ALERT: All pets are accepted on the subway taxi and trains during evacuation. #Sandy #SandyPets,Informative (Indirect),Marketa1981
386,Caution and advice,NYC Mayor Bloomberg is offering an update on the city's response to #Sandy. You can tune in here: http://t.co/QWZpbEhv,Informative (Indirect),MarketWatch
387,"Donations of money, goods or services",Info on #MGH staff who have deployed to NYC in response to hurricane #Sandy: http://t.co/CoNcGOvL,Informative (Indirect),MassGeneralNews
388,Casualties and damage,MTA chairman: There are 7 subway tunnels that connect Manhattan to Brooklyn & Queens those 7 are flooded #nyc #Sandy,Informative (Indirect),MauriceMichael
389,Casualties and damage,Couple of NYC photos from Reddit showing the effects of Sandy so far - http://t.co/kLeV3Zod NYC Subway Station,Informative (Indirect),maxwood
390,Unknown,@NYCeditor Not for days but look here: http://t.co/lkARMvgS,Informative (Indirect),MeakinArmstrong
391,Unknown,Both #FoolHQ and the market will reopen tomorrow. Meanwhile our thoughts are with Sandy's victims and those still flooded or in the dark.,Informative (Indirect),meganlisajones
392,Caution and advice,LIVE VIDEO: NYC Mayor Michael Bloomberg updates residents on Hurricane #Sandy http://t.co/XtzsBslf,Informative (Indirect),meggy009
393,Unknown,Unbelievable. #sandy #frankenstorm #nyc http://t.co/n4kUwJEF,Informative (Indirect),melancholymaze
394,Unknown,Speechless and Honored! Tomb of the Unknowns during #Sandy. http://t.co/A5iFOT8P http://t.co/rZSOvggZ,Informative (Indirect),MelissaMAngus
395,Information Source,#Sandy - jetskier down Battery Park #NYC #newyorkcity vid soon youtube - OpieRadio http://t.co/wRmvMA5m,Informative (Indirect),memeseeker
396,Casualties and damage,Wow. Stay safe east coasters RT ÃƒÂ¤ÃƒÂ³ÃƒÂ¬@NZStuff: Millions wake to destruction in Sandy's aftermath http://t.co/TzzmMiArÃƒÂ¤ÃƒÂ³Ã‚Â,Informative (Indirect),mermaidmoll
397,"Donations of money, goods or services",Water and ice distribution locations for Met-Ed customers who lost power as a result of Hurricane Sandy: http://t.co/4losm4IT,Informative (Indirect),Met_Ed
398,Unknown,Sandy Wallops Obama Romney Plans http://t.co/9efFR6sz (via @ABC),Informative (Indirect),MhquilesMiriam
399,Unknown,"#USA Less people """"left in the dark"""" after #Sandy than before http://t.co/6Xq7qW79 #miracle",Informative (Indirect),MichaelLee2009
400,Caution and advice,.@NYGovCuomo orders closing of NYC bridges. Only Staten Island bridges unaffected at this time. Bridges must close by 7pm. #Sandy #NYC,Informative (Indirect),MichelleRafter
401,Information Source,Created a timelapse of hurricane #Sandy passing through 42nd & 10th New York http://t.co/N188sBX0,Informative (Indirect),migueldeicaza
402,Casualties and damage,Door to our roof was ripped off its hinges. Super is already fixing it! #nyc #Sandy http://t.co/nIfEPDip,Informative (Indirect),mirseum
403,Casualties and damage,#Prayers 'Unthinkable devastation' Sandy causes at least 29 U.S. deaths http://t.co/9p4biw5V,Informative (Indirect),missclass
404,Unknown,"Sandy vs. Lady Liberty RT: """"@kateesackhoff: Holy shit! http://t.co/LBLJlljD #HurricaneSandy #NYC""""",Informative (Indirect),missHannahSwe
405,"Donations of money, goods or services",RT If in immediate need of shelter please visit http://t.co/rn0Sku35 ÃƒÂ¤ÃƒÂ³_ to locate your nearest options. #shelter #Sandy,Informative (Indirect),MisticaLaVidaEs
406,Information Source,Nice RT @Slate Awesome interactive #Sandy map from Google pinpointing emergency shelter traffic conditions and more: http://t.co/8QvR3C6u,Informative (Indirect),MJ_Tom_Skoch
407,Casualties and damage,Barack Obama to visit New Jersey after Superstorm Sandy kills 50 people and causes $20billion worth of damage http://t.co/6jnSsJFs,Informative (Indirect),mnjoben
408,Casualties and damage,TotallyCoolPix: The Hurricane Sandy Aftermath: She came she saw she destroyed. Hurricane Sandy came ashore las... http://t.co/Rl978fwW,Informative (Indirect),MoeiiMaker
409,Casualties and damage,Mayor Bloomberg: Over 1000 reports of downed trees and other problems with debris in #NYC. #Sandy,Informative (Indirect),momof3mary
410,Information Source,Obama lands in Atlantic City New Jersey to observe #Sandy damage -ABC,Informative (Indirect),muntakadabo
411,Unknown,A SoCal family won't let #Sandy keep them from getting to Army boot camp graduation: http://t.co/tIerZiCx,Informative (Indirect),MyDesert
412,Caution and advice,All bridges tunnels in NYC closed except for Lincoln Tunnel. #sandyonfox http://t.co/UQ6QYH09,Informative (Indirect),MyFoxNY
413,Casualties and damage,Storm was most destructive in 108-year history of NYC subway system says MTA chief Lhota. http://t.co/XbvLF31t,Informative (Indirect),NataschaDea
414,Caution and advice,.@NYGovCuomo orders closing of NYC bridges. Only Staten Island bridges unaffected at this time. Bridges must close by 7pm. #Sandy #NYC,Informative (Indirect),Nelmcadoo
415,Casualties and damage,ConEd: Number of NYC-area customers without power is about 68700 and is sure to keep rising http://t.co/MXylkmqu,Informative (Indirect),NewsalertsVNS
416,Casualties and damage,Sandy moves west leaving devastation deaths in its wake: The Atlantic superstorm Sandy churned across Pennsy... http://t.co/jB6x2Zxa,Informative (Indirect),newsandtribune
417,Casualties and damage,NYC Mayor Bloomberg - More than 20 fires spawned by storm #Sandy,Informative (Indirect),NewsRadio930
418,Casualties and damage,Mayor Bloomberg: Over 1000 reports of downed trees and other problems with debris in #NYC. #Sandy,Informative (Indirect),nicecap
419,Unknown,NYC restos playing it by ear during #Sandy. Props to @EaterNY on their running list of what's open ÃƒÂ¤ÃƒÂ³ÃƒÂ® http://t.co/6yGdRXn0,Informative (Indirect),NicoMcLane
420,"Donations of money, goods or services",Yankees to donate $500000 to Hurricane Sandy relief efforts http://t.co/3z6N6e0M,Informative (Indirect),NJ_NYC
421,Information Source,"Damn!RT @fcfortune: RT @iamsiree: RT @damnitstrue: This photo of #Sandy looks straight from ""The ... http://t.co/El0JSpLI",Informative (Indirect),Noks009
422,Caution and advice,BLIZZARD WARNINGS IN WEST VIRGINIA ÃƒÂ¤ÃƒÂ³ÃƒÂ® WHILE HURRICANE SANDY THREATENS: http://t.co/suAeqpui,Informative (Indirect),normsantos
423,Caution and advice,Delta has what seems like a very optimistic plan to resume some NYC flights on Tuesday: http://t.co/A2mjbStn,Informative (Indirect),NYCAviation
424,Casualties and damage,#Sandy hitting NYC: 47000 customers without power in new york city.,Informative (Indirect),nyckennedy
425,Caution and advice,In sum: http://t.co/jJUy1y8F Stay inside try to relax don't go being macho and running into the water. #Sandy #MayorBloomberg,Informative (Indirect),nycTrend
426,Caution and advice,Limited train service resuming in NYC after superstorm Sandy - CBS News: National GeographicLimited tra... http://t.co/t1j1hPKO #newyork,Informative (Indirect),NYNewYorkCity
427,Casualties and damage,More #Sandy impact: Bellevue NYC's flagship public hospital loses power now evacuating 500 patients hospital says.,Informative (Indirect),NYTMetro
428,Casualties and damage,Update: Crane Collapse... developing... #hurricance #nyc #sandy http://t.co/0jvimS1s,Informative (Indirect),o0REL
429,Unknown,NYC ... Live #wow #sandy http://t.co/FAUzMHrY,Informative (Indirect),OllyOHJ
430,Information Source,Hurricane Sandy from Space http://t.co/LQflUgKr,Informative (Indirect),olwynf
431,Information Source,If you haven't already seen that amazing pic of #NYC with #Sandy coming look now http://t.co/jEaP5n9e,Informative (Indirect),ooleilaa
432,Caution and advice,Sandy approaching northeast U.S. http://t.co/cDuyLxA2,Informative (Indirect),optimismnow2
433,Casualties and damage,This says a lot. Hurricane Sandy's death toll as viewed by the BBC: http://t.co/UPPLzNNY (via @jackseale),Informative (Indirect),owensm1th
434,"Donations of money, goods or services",Last night Red Cross opened 112 shelters for #Sandy w/over 3200 people in them. http://t.co/0uk5URJH Support them by texting (contÃƒÂ¤ÃƒÂ³_,Informative (Indirect),pabloezequielm2
435,Unknown,We did it homos! Not only did we conjure Hurricane Sandy we left our rainbow calling card behind in NYC (via @abcnews) http://t.co/6up1ZOr2,Informative (Indirect),PantsofStella
436,Casualties and damage,#US #media When you reports deaths from #Sandy also note the 66 confirmed in the Caribbean phase of the storm.,Informative (Indirect),pattigibbons
437,Caution and advice,MT @ZagatNYC: NYC restos playing it by ear during #Sandy. Props to @EaterNY on their list of what's open ÃƒÂ¤ÃƒÂ³ÃƒÂ® http://t.co/tAbiGqSo @kale1919,Informative (Indirect),PaulBell55
438,Unknown,"Hurricane Sandy: Is climate change to blame?: """"New York isn't known for its hurricanes"""" says Will Oremus at Sla... http://t.co/J5FCNgJ5",Informative (Indirect),PeedroDionisio
439,Information Source,In stunning footage filmmaker for NYC's @MTAInsider shows disastrous effects of Sandy on city's transportation system http://t.co/L6l3QiRv,Informative (Indirect),peterknegt
440,Information Source,Memorable Sandy photos shared by NYC bystanders from last night http://t.co/NAxcI7Zl h/t @lheron #Sandy,Informative (Indirect),pgMila
441,Casualties and damage,NYC firefighters look up at a collapsed crane dangling from a building | http://t.co/8abQk4SC #Sandy,Informative (Indirect),PieBongio
442,Caution and advice,#RedCross Hurricane app can help you recover from #Sandy. Go to the Prepare tab then hit ÃƒÂ¤ÃƒÂ³ÃƒÂ¬AfterÃƒÂ¤ÃƒÂ³Ã‚Â. http://t.co/fYMpaDYc,Informative (Indirect),PiedmontHousing
443,Casualties and damage,"Checking out """"US under """"attack"""" :Sandy kills 39 as National Guard mobilized as"""" on 9jabook: http://t.co/JILvYJHQ",Informative (Indirect),pimpmy9jabook
444,Casualties and damage,"US under """"attack"""" :Sandy kills 39 as National Guard mobilized as power Shutsdown 11m homes in North East America http://t.co/JILvYJHQ",Informative (Indirect),pimpmy9jabook
445,Casualties and damage,NYC firefighters look up at a collapsed crane dangling from a building | http://t.co/8abQk4SC #Sandy,Informative (Indirect),PlayTaxiMedia
446,Casualties and damage,NYC firefighters look up at a collapsed crane dangling from a building | http://t.co/8abQk4SC #Sandy,Informative (Indirect),PoetryNEarth
447,Unknown,"the Ed Koch bridge is the only one still open prompting questions """"How's he doing?"""" #sandy #nyc",Informative (Indirect),popcultpirate
448,Caution and advice,If you need a safe place to stay shelter info avail. in #Hurricane app http://t.co/4qNCbnTW & http://t.co/gtQEoxjS. #Sandy,Informative (Indirect),PoppenReport
449,Information Source,"NASA Image of Sandy --Experts Ask: """"Is a 'Hypercane' Possible"""" http://t.co/E0SHEF6n",Informative (Indirect),PTTU
450,Casualties and damage,NYC firefighters look up at a collapsed crane dangling from a building | http://t.co/8abQk4SC #Sandy,Informative (Indirect),Pucemargine
451,Information Source,This @NYTimes graphic of Sandy damage is outstanding. This is what the future of news looks like: http://t.co/byIERmSV,Informative (Indirect),pvt_idaho
452,Information Source,Full uninterrupted coverage at http://t.co/RqidCs7W #sandy #sandy nyc,Informative (Indirect),QFinnerty
453,Unknown,Freedom tower in the middle of sandy #frankenstorm. #nyc #sandy #stormking #flood http://t.co/9Nr5OF7C,Informative (Indirect),rahav
454,Casualties and damage,#Sandy In #Haiti 54 confirmed deaths were reported 20 injured and 20 missing http://t.co/Kbe1Jp7o cc: @pahodisasters,Informative (Indirect),RealityRadioTT
455,Caution and advice,#IFWT Experts Say 8 O'Clock Is When Hurricane Sandy Unleashes Her Fury On NYC - http://t.co/jfOwCb5o,Informative (Indirect),RealMGillette
456,Information Source,Absurd. Looks like Titanic MT @BloombergTV: What do damaged NYC subways look like inside? WATCH this dramatic footage: http://t.co/5vldTf3m,Informative (Indirect),RebeccaShabad
457,Information Source,What do damaged NYC subways look like inside? WATCH this dramatic MTA footage: http://t.co/7BX9dVx1,Informative (Indirect),Rezar14
458,Casualties and damage,ÃƒÂ¤ÃƒÂ³ÃƒÂ¬@naugusta: NYC Mayor Bloomberg says most without power in Queens and Staten Island. #SandyÃƒÂ¤ÃƒÂ³Ã‚ÂÃƒÂ¤ÃƒÂ³Ã‚Â #statenisland #nyc #sandyabc7,Informative (Indirect),Richie_Brienza
459,Caution and advice,The latest as Hurricane Sandy hits landfall. Rolling news coverage @SkyNews throughout the night,Informative (Indirect),RNorthumberland
460,Casualties and damage,Stay safe! #NYC RT @WSJNY Crane crumples above One57 ManhattanÃƒÂ¤ÃƒÂ³Ã‚Â»s glitziest condo. #Sandy http://t.co/KVoA7ywr via @WSJ,Informative (Indirect),RobertaKLEEDAP
461,Casualties and damage,At least 50 people died in the US during Hurricane Sandy. Power out to hundreds of thousands. Schools still closed.,Informative (Indirect),ROCK977
462,Caution and advice,RT @weatherchannel: @NYGovCuomo orders closing of NYC bridges. Only Staten Island bridges unaffected at this time. Must close by 7pm. #Sandy,Informative (Indirect),rumsoncds
463,Information Source,The most impressive pics and videos of Hurricane Sandy from space http://t.co/TWKK0DtX,Informative (Indirect),safetylanguage
464,Casualties and damage,Problems at Five Nuke Plants http://t.co/DtceY4pS,Informative (Indirect),safetyskeptic
465,Unknown,Now that the sun is down and you're hopefully safely inside share your hurricane photos with us. http://t.co/DUaTtgYJ #nhsandy,Informative (Indirect),SalemNHPatch
466,Caution and advice,ALERT: List of NJ PA and DE shelters - including those that are pet friendly http://t.co/K3T7t91E #sandy #sandypets,Informative (Indirect),SallyMos
467,Information Source,BBC News - Sandy: President Obama visits New Jersey http://t.co/W4D85xzz,Informative (Indirect),sammy29c
